{
  "$schema": "https://orknux.ai/marketplace/plugin.schema.json",
  "key": "slack",
  "name": "Slack",
  "author": "Orknux",
  "summary": "Read threads, messages and users, post, react and search — and carry files both ways, text or binary.",
  "version": "1.2.0",
  "icon": "icon.svg",
  "descriptionPath": "README.md"
}
