{
  "$schema": "https://orknux.ai/marketplace/plugin.schema.json",
  "key": "date",
  "name": "Dates & Working Calendar",
  "author": "Orknux",
  "summary": "Business days, working hours and date arithmetic that gets month ends and daylight saving right.",
  "version": "0.2.0",
  "icon": "icon.svg",
  "descriptionPath": "README.md"
}
